File,Category,Priority,Status,Description
index.html,Main Pages,High,Created,Core website page - Index
ueber-uns.html,Main Pages,High,Created,Core website page - Ueber Uns
team.html,Main Pages,High,Created,Core website page - Team
leistungen.html,Main Pages,High,Template Needed,Core website page - Leistungen
transaktionen.html,Main Pages,High,Template Needed,Core website page - Transaktionen
kontakt.html,Main Pages,High,Template Needed,Core website page - Kontakt
seo-pages/emergency/notverkauf-unternehmen-giessen.html,SEO - Emergency,High,Created,SEO landing page for notverkauf unternehmen giessen
seo-pages/emergency/schneller-unternehmensverkauf-giessen.html,SEO - Emergency,High,Template Needed,SEO landing page for schneller unternehmensverkauf giessen
seo-pages/emergency/firma-sofort-verkaufen-giessen.html,SEO - Emergency,High,Template Needed,SEO landing page for firma sofort verkaufen giessen
seo-pages/emergency/dringend-nachfolger-gesucht-giessen.html,SEO - Emergency,High,Template Needed,SEO landing page for dringend nachfolger gesucht giessen
seo-pages/emergency/eiliger-geschaeftsverkauf-mittelhessen.html,SEO - Emergency,High,Template Needed,SEO landing page for eiliger geschaeftsverkauf mittelhessen
seo-pages/problems/unternehmensnachfolge-ohne-nachfolger-giessen.html,SEO - Problems,Medium,Template Needed,SEO landing page for unternehmensnachfolge ohne nachfolger giessen
seo-pages/problems/firma-verkaufen-ohne-gewinn-giessen.html,SEO - Problems,Medium,Template Needed,SEO landing page for firma verkaufen ohne gewinn giessen
seo-pages/problems/keine-nachkommen-unternehmensnachfolge-giessen.html,SEO - Problems,Medium,Template Needed,SEO landing page for keine nachkommen unternehmensnachfolge giessen
seo-pages/problems/kranker-geschaeftsfuehrer-nachfolge-giessen.html,SEO - Problems,Medium,Template Needed,SEO landing page for kranker geschaeftsfuehrer nachfolge giessen
seo-pages/problems/altersbedingte-geschaeftsaufgabe-giessen.html,SEO - Problems,Medium,Template Needed,SEO landing page for altersbedingte geschaeftsaufgabe giessen
seo-pages/services/unternehmensbewertung-giessen.html,SEO - Services,Medium,Template Needed,SEO landing page for unternehmensbewertung giessen
seo-pages/services/due-diligence-beratung-giessen.html,SEO - Services,Medium,Template Needed,SEO landing page for due diligence beratung giessen
seo-pages/services/ma-berater-giessen.html,SEO - Services,Medium,Created,SEO landing page for ma berater giessen
seo-pages/services/nachfolgeberatung-mittelstand-giessen.html,SEO - Services,Medium,Template Needed,SEO landing page for nachfolgeberatung mittelstand giessen
seo-pages/services/anonymes-bieterverfahren-giessen.html,SEO - Services,Medium,Template Needed,SEO landing page for anonymes bieterverfahren giessen
seo-pages/locations/ma-beratung-giessen-marburg.html,SEO - Locations,Low,Template Needed,SEO landing page for ma beratung giessen marburg
seo-pages/locations/unternehmensnachfolge-wetzlar-giessen.html,SEO - Locations,Low,Template Needed,SEO landing page for unternehmensnachfolge wetzlar giessen
seo-pages/locations/unternehmensverkauf-lahn-dill-kreis.html,SEO - Locations,Low,Template Needed,SEO landing page for unternehmensverkauf lahn dill kreis
seo-pages/locations/nachfolgeberatung-mittelhessen.html,SEO - Locations,Low,Template Needed,SEO landing page for nachfolgeberatung mittelhessen
seo-pages/commercial/unternehmensverkauf-preis-giessen.html,SEO - Commercial,Low,Template Needed,SEO landing page for unternehmensverkauf preis giessen
seo-pages/commercial/ma-berater-kosten-giessen.html,SEO - Commercial,Low,Template Needed,SEO landing page for ma berater kosten giessen
seo-pages/commercial/nachfolgeberatung-honorar-giessen.html,SEO - Commercial,Low,Template Needed,SEO landing page for nachfolgeberatung honorar giessen
seo-pages/commercial/kostenlose-erstberatung-ma-giessen.html,SEO - Commercial,Low,Template Needed,SEO landing page for kostenlose erstberatung ma giessen
